{"$schema":"https://json-schema.org/draft/2020-12/schema","$id":"https://eaglevision.digital/schemas/express-intake-v1.json","title":"Eagle Vision Express Client Intake","type":"object","additionalProperties":false,"required":["schemaVersion","submission","package","business","goals","offerings","brand","contentPolicy","pages","capabilities","media","permissions"],"properties":{"schemaVersion":{"const":"1.0.0"},"submission":{"type":"object","additionalProperties":false,"required":["submissionId","status","source"],"properties":{"submissionId":{"type":"string","minLength":6},"leadCaptureId":{"type":["string","null"]},"status":{"enum":["draft","client_confirmed","eagle_vision_review","accepted_for_build","generation_started","generated","qa","dave_review","client_review","revision","approved","launched"]},"source":{"enum":["self_service","sales_assisted","imported","internal"]},"utm":{"type":"object","additionalProperties":false,"properties":{"source":{"type":["string","null"]},"medium":{"type":["string","null"]},"campaign":{"type":["string","null"]},"content":{"type":["string","null"]},"referrer":{"type":["string","null"]}}},"startedAt":{"type":["string","null"],"format":"date-time"},"clientConfirmedAt":{"type":["string","null"],"format":"date-time"},"acceptedForBuildAt":{"type":["string","null"],"format":"date-time"}}},"package":{"type":"object","additionalProperties":false,"required":["product"],"properties":{"product":{"enum":["website","app","website_app"]},"websiteTier":{"enum":["express_standard","express_plus","custom","not_applicable"]},"appTier":{"enum":["express_standard","express_plus","custom","not_applicable"]},"salesProgram":{"enum":["standard","payments_discount","free_website_promo","partner","custom"]},"requestedLaunchDate":{"type":["string","null"],"format":"date"}}},"business":{"type":"object","additionalProperties":false,"required":["legalOrPublicName","industry","primaryContact","locations"],"properties":{"legalOrPublicName":{"type":"string","minLength":2},"industry":{"enum":["local_service","church_ministry","restaurant","coach_consultant","salon_spa_beauty","fitness_gym","real_estate","automotive_repair","retail_boutique","nonprofit","professional_services","other"]},"industryOther":{"type":["string","null"]},"oneLineDescription":{"type":["string","null"],"maxLength":300},"primaryContact":{"type":"object","additionalProperties":false,"required":["firstName","lastName","email","phone"],"properties":{"firstName":{"type":"string"},"lastName":{"type":"string"},"role":{"type":["string","null"]},"email":{"type":"string","format":"email"},"phone":{"type":"string","minLength":7}}},"currentWebsiteUrl":{"type":["string","null"],"format":"uri"},"currentApp":{"type":["object","null"],"additionalProperties":false,"properties":{"exists":{"type":"boolean"},"platform":{"type":["string","null"]},"url":{"type":["string","null"],"format":"uri"}}},"locations":{"type":"array","minItems":1,"items":{"type":"object","additionalProperties":false,"required":["name","city","region"],"properties":{"name":{"type":"string"},"street":{"type":["string","null"]},"city":{"type":"string"},"region":{"type":"string"},"postalCode":{"type":["string","null"]},"country":{"type":"string","default":"US"},"public":{"type":"boolean","default":true},"phone":{"type":["string","null"]},"email":{"type":["string","null"],"format":"email"},"hours":{"type":["string","null"]}}}},"serviceAreas":{"type":"array","items":{"type":"string"}},"socialLinks":{"type":"array","items":{"type":"string","format":"uri"}}}},"goals":{"type":"object","additionalProperties":false,"required":["primaryAction"],"properties":{"primaryAction":{"enum":["call","request_quote","book","visit","order","register","donate","join","watch","contact","shop","other"]},"primaryActionOther":{"type":["string","null"]},"secondaryActions":{"type":"array","items":{"type":"string"},"maxItems":4},"targetAudience":{"type":["string","null"],"maxLength":800},"customerProblem":{"type":["string","null"],"maxLength":800},"differentiators":{"type":"array","items":{"type":"string","maxLength":350},"maxItems":6},"proudOf":{"type":["string","null"],"maxLength":800},"approvedProofPoints":{"type":"array","items":{"type":"object","additionalProperties":false,"required":["claim","verified"],"properties":{"claim":{"type":"string"},"category":{"enum":["years","license","insurance","certification","award","rating","guarantee","pricing","result","theology","other"]},"verified":{"type":"boolean"},"sourceNote":{"type":["string","null"]}}}}}},"offerings":{"type":"array","minItems":1,"maxItems":30,"items":{"type":"object","additionalProperties":false,"required":["name","featured"],"properties":{"id":{"type":["string","null"]},"name":{"type":"string"},"descriptionOrNotes":{"type":["string","null"],"maxLength":1500},"featured":{"type":"boolean"},"publicPrice":{"type":["string","null"]},"cta":{"type":["string","null"]},"contentHandlingOverride":{"enum":["inherit","exact","light_polish","professional_rewrite"]}}}},"brand":{"type":"object","additionalProperties":false,"required":["visualDescriptors","colorStrategy","appearancePreference"],"properties":{"visualDescriptors":{"type":"array","minItems":1,"maxItems":3,"items":{"enum":["professional","premium","friendly","modern","bold","traditional","warm","elegant","fun","rugged","minimal","family_oriented"]}},"colorStrategy":{"enum":["use_brand_colors","pull_from_logo","eagle_vision_recommends","curated_palette"]},"appearancePreference":{"enum":["light","dark","eagle_vision_chooses"]},"existingColors":{"type":"array","items":{"type":"string"},"maxItems":8},"inspirationUrls":{"type":"array","items":{"type":"string","format":"uri"},"maxItems":5},"designDirection":{"enum":["client_selected","eagle_vision_selects"]}}},"contentPolicy":{"type":"object","additionalProperties":false,"required":["defaultHandling"],"properties":{"defaultHandling":{"enum":["exact","light_polish","professional_rewrite"]},"about":{"enum":["inherit","exact","light_polish","professional_rewrite"]},"mission":{"enum":["inherit","exact","light_polish","professional_rewrite"]},"bios":{"enum":["inherit","exact","light_polish","professional_rewrite"]},"beliefs":{"enum":["not_applicable","exact","light_polish"]},"testimonials":{"enum":["exact","light_polish_with_permission"]},"legalDisclaimers":{"const":"exact"},"aboutNotes":{"type":["string","null"],"maxLength":5000},"missionNotes":{"type":["string","null"],"maxLength":3000},"historyNotes":{"type":["string","null"],"maxLength":3000}}},"people":{"type":"array","items":{"type":"object","additionalProperties":false,"required":["name","role"],"properties":{"name":{"type":"string"},"role":{"type":"string"},"bioOrBullets":{"type":["string","null"],"maxLength":3000},"publicEmail":{"type":["string","null"],"format":"email"},"publicPhone":{"type":["string","null"]},"mediaAssetId":{"type":["string","null"]},"contentHandlingOverride":{"enum":["inherit","exact","light_polish","professional_rewrite"]}}}},"pages":{"type":"object","additionalProperties":false,"required":["selectionMode","selected"],"properties":{"selectionMode":{"enum":["accept_recommended","customize"]},"selected":{"type":"array","minItems":1,"maxItems":20,"items":{"type":"string"}},"additionalPaidPages":{"type":"array","items":{"type":"string"}},"utilityPages":{"type":"array","items":{"enum":["privacy","terms","accessibility","thank_you","cookie_notice","other"]}}}},"capabilities":{"type":"array","items":{"type":"object","additionalProperties":false,"required":["capabilityId","needed"],"properties":{"capabilityId":{"type":"string"},"needed":{"type":"boolean"},"priority":{"enum":["must_have","nice_to_have","future"]},"notes":{"type":["string","null"],"maxLength":1000}}}},"integrations":{"type":"array","items":{"type":"object","additionalProperties":false,"required":["category","provider","keepExisting"],"properties":{"category":{"enum":["pos","ordering","booking","crm","giving","payments","email_marketing","ecommerce","video","calendar","forms","analytics","other"]},"provider":{"type":"string"},"keepExisting":{"type":"boolean"},"integrationNeeds":{"type":"array","items":{"type":"string"}},"publicUrl":{"type":["string","null"],"format":"uri"},"notes":{"type":["string","null"],"maxLength":1200}}}},"sourceMaterials":{"type":"array","items":{"type":"object","additionalProperties":false,"required":["category","fileName"],"properties":{"category":{"type":"string"},"fileName":{"type":"string"},"mimeType":{"type":["string","null"]},"sizeBytes":{"type":["number","null"]}}}},"media":{"type":"array","items":{"type":"object","additionalProperties":false,"required":["assetId","kind","label","rightsConfirmed","placement"],"properties":{"assetId":{"type":"string"},"kind":{"enum":["logo","alternate_logo","brand_guide","photo","video","pdf","menu","brochure","document","other"]},"label":{"enum":["owner_founder","team_member","staff_group","location","facility","project_work","product","food_menu_item","event","logo","brand_guide","source_material","other"]},"subject":{"type":["string","null"]},"caption":{"type":["string","null"]},"placement":{"enum":["anywhere","homepage","about","team","gallery","specific_service","website_only","app_only","source_only"]},"specificService":{"type":["string","null"]},"rightsConfirmed":{"type":"boolean"},"sourceUrl":{"type":["string","null"],"format":"uri"},"uploadToken":{"type":["string","null"]}}}},"industryData":{"type":"object","additionalProperties":false,"properties":{"localService":{"type":["object","null"],"additionalProperties":false,"properties":{"emergencyService":{"type":["boolean","null"]},"freeEstimates":{"type":["boolean","null"]},"financingAvailable":{"type":["boolean","null"]},"licensesOrCredentials":{"type":"array","items":{"type":"string"}},"serviceAreaStrategy":{"enum":["single_location","radius","named_areas","statewide","nationwide","not_applicable"]}}},"churchMinistry":{"type":["object","null"],"additionalProperties":false,"properties":{"serviceTimes":{"type":"array","items":{"type":"string"}},"pastorOrLeader":{"type":["string","null"]},"beliefsText":{"type":["string","null"]},"ministries":{"type":"array","items":{"type":"string"}},"givingUrl":{"type":["string","null"],"format":"uri"},"mediaFeedUrls":{"type":"array","items":{"type":"string","format":"uri"}},"planVisitNeeds":{"type":"array","items":{"type":"string"}}}},"restaurant":{"type":["object","null"],"additionalProperties":false,"properties":{"cuisine":{"type":["string","null"]},"hasOnlineOrdering":{"type":["boolean","null"]},"orderingProvider":{"type":["string","null"]},"hasPos":{"type":["boolean","null"]},"posProvider":{"type":["string","null"]},"keepExistingPos":{"type":["boolean","null"]},"needsNewPosRecommendation":{"type":["boolean","null"]},"reservationProvider":{"type":["string","null"]},"menuSource":{"enum":["uploaded_pdf","uploaded_data","existing_url","pos","manual","unknown","not_applicable"]},"orderingIntegrationNeeds":{"type":"array","items":{"enum":["online_ordering","menu","payments","loyalty","reservations","customer_data","delivery","other"]}}}}}},"app":{"type":["object","null"],"additionalProperties":false,"properties":{"experiencePreference":{"enum":["classic","menu","directory","eagle_vision_chooses"]},"requiresLogin":{"type":"boolean"},"accessGroups":{"type":"array","items":{"type":"string"}},"developerAccountPreference":{"enum":["client_owned","eagle_vision_guidance_needed","unknown"]},"existingAppleAccount":{"type":["boolean","null"]},"existingGoogleAccount":{"type":["boolean","null"]},"bundleIdPreference":{"type":["string","null"]}}},"information":{"type":"array","description":"Optional explicit provenance records for sensitive or imported facts.","items":{"type":"object","additionalProperties":false,"required":["fieldPath","confidence"],"properties":{"fieldPath":{"type":"string"},"confidence":{"enum":["verified","imported","generated"]},"source":{"type":["string","null"]},"confirmedAt":{"type":["string","null"],"format":"date-time"}}}},"permissions":{"type":"object","additionalProperties":false,"required":["contentRightsConfirmed","testimonialRightsConfirmed","contactPermission"],"properties":{"contentRightsConfirmed":{"type":"boolean"},"testimonialRightsConfirmed":{"type":"boolean"},"contactPermission":{"type":"boolean"},"legalAuthorityToApprove":{"type":"boolean"}}},"review":{"type":"object","additionalProperties":false,"properties":{"clientSummaryConfirmed":{"type":"boolean"},"clientConfirmedVersion":{"type":["string","null"]},"daveApprovedVersion":{"type":["string","null"]},"finalApprovedVersion":{"type":["string","null"]}}}}}